{
  "$schema": "https://unpkg.com/@broject/bro/schemas/pack.schema.json",
  "name": "@broject/bro-pack",
  "version": "0.2.5",
  "requires": {
    "bro": ">=0.2.5"
  },
  "skills": [
    "acp",
    "act",
    "agents",
    "check",
    "convoy",
    "daemon",
    "debt",
    "delegate",
    "docs",
    "dogfood",
    "drill",
    "drive",
    "goal",
    "guard",
    "judge",
    "learn",
    "loop",
    "mcp",
    "mesh",
    "next",
    "notify",
    "provider",
    "providers",
    "pulse",
    "query",
    "resume",
    "retro",
    "rig",
    "sdd",
    "serve",
    "stack",
    "status",
    "sweep",
    "sync",
    "trace",
    "typesafe-ai",
    "watch",
    "work",
    "wtf"
  ],
  "formulas": ["debt-pipeline.formula.toml", "ship-bead.formula.toml"]
}
